OpenROAD v2.0-3879-g0b8b7ae25 
This program is licensed under the BSD-3 license. See the LICENSE file for details.
Components of this program may be licensed under more restrictive licenses which must be honored.
[INFO ODB-0222] Reading LEF file: /foss/designs/SKY130_SAR-ADC/openlane/adc_edge_detect_circuit/runs/foobar/tmp/merged.unpadded.nom.lef
[INFO ODB-0223]     Created 13 technology layers
[INFO ODB-0224]     Created 25 technology vias
[INFO ODB-0225]     Created 442 library cells
[INFO ODB-0226] Finished LEF file:  /foss/designs/SKY130_SAR-ADC/openlane/adc_edge_detect_circuit/runs/foobar/tmp/merged.unpadded.nom.lef
[INFO ODB-0127] Reading DEF file: /foss/designs/SKY130_SAR-ADC/openlane/adc_edge_detect_circuit/runs/foobar/tmp/routing/12-global.def
[INFO ODB-0128] Design: adc_edge_detect_circuit
[INFO ODB-0130]     Created 5 pins.
[INFO ODB-0131]     Created 720 components and 2709 component-terminals.
[INFO ODB-0132]     Created 4 special nets and 2700 connections.
[INFO ODB-0133]     Created 6 nets and 9 connections.
[INFO ODB-0134] Finished DEF file: /foss/designs/SKY130_SAR-ADC/openlane/adc_edge_detect_circuit/runs/foobar/tmp/routing/12-global.def
[INFO ORD-0030] Using 2 thread(s).
[INFO DRT-0149] Reading tech and libs.

Units:                1000
Number of layers:     13
Number of macros:     442
Number of vias:       25
Number of viarulegen: 25

[INFO DRT-0150] Reading design.

Design:                   adc_edge_detect_circuit
Die area:                 ( 0 0 ) ( 100000 100000 )
Number of track patterns: 12
Number of DEF vias:       3
Number of components:     720
Number of terminals:      5
Number of snets:          4
Number of nets:           6

[INFO DRT-0167] List of default vias:
  Layer mcon
    default via: L1M1_PR
  Layer via
    default via: M1M2_PR
  Layer via2
    default via: M2M3_PR
  Layer via3
    default via: M3M4_PR
  Layer via4
    default via: M4M5_PR
[INFO DRT-0162] Library cell analysis.
[INFO DRT-0163] Instance analysis.
[INFO DRT-0164] Number of unique instances = 19.
[INFO DRT-0168] Init region query.
[INFO DRT-0024]   Complete FR_MASTERSLICE.
[INFO DRT-0024]   Complete FR_VIA.
[INFO DRT-0024]   Complete li1.
[INFO DRT-0024]   Complete mcon.
[INFO DRT-0024]   Complete met1.
[INFO DRT-0024]   Complete via.
[INFO DRT-0024]   Complete met2.
[INFO DRT-0024]   Complete via2.
[INFO DRT-0024]   Complete met3.
[INFO DRT-0024]   Complete via3.
[INFO DRT-0024]   Complete met4.
[INFO DRT-0024]   Complete via4.
[INFO DRT-0024]   Complete met5.
[INFO DRT-0033] FR_MASTERSLICE shape region query size = 0.
[INFO DRT-0033] FR_VIA shape region query size = 0.
[INFO DRT-0033] li1 shape region query size = 3783.
[INFO DRT-0033] mcon shape region query size = 10836.
[INFO DRT-0033] met1 shape region query size = 1567.
[INFO DRT-0033] via shape region query size = 294.
[INFO DRT-0033] met2 shape region query size = 178.
[INFO DRT-0033] via2 shape region query size = 236.
[INFO DRT-0033] met3 shape region query size = 185.
[INFO DRT-0033] via3 shape region query size = 234.
[INFO DRT-0033] met4 shape region query size = 72.
[INFO DRT-0033] via4 shape region query size = 0.
[INFO DRT-0033] met5 shape region query size = 0.
[INFO DRT-0165] Start pin access.
[INFO DRT-0078]   Complete 7 pins.
[INFO DRT-0081]   Complete 12 unique inst patterns.
[INFO DRT-0084]   Complete 4 groups.
#scanned instances     = 720
#unique  instances     = 18
#stdCellGenAp          = 57
#stdCellValidPlanarAp  = 4
#stdCellValidViaAp     = 46
#stdCellPinNoAp        = 0
#stdCellPinCnt         = 9
#instTermValidViaApCnt = 0
#macroGenAp            = 0
#macroValidPlanarAp    = 0
#macroValidViaAp       = 0
#macroNoAp             = 0
[INFO DRT-0166] Complete pin access.
[INFO DRT-0267] cpu time = 00:00:00, elapsed time = 00:00:00, memory = 104.65 (MB), peak = 104.65 (MB)
[INFO DRT-0151] Reading guide.

Number of guides:     28

[INFO DRT-0169] Post process guides.
[INFO DRT-0176] GCELLGRID X 0 DO 14 STEP 6900 ;
[INFO DRT-0177] GCELLGRID Y 0 DO 14 STEP 6900 ;
[INFO DRT-0028]   Complete FR_MASTERSLICE.
[INFO DRT-0028]   Complete FR_VIA.
[INFO DRT-0028]   Complete li1.
[INFO DRT-0028]   Complete mcon.
[INFO DRT-0028]   Complete met1.
[INFO DRT-0028]   Complete via.
[INFO DRT-0028]   Complete met2.
[INFO DRT-0028]   Complete via2.
[INFO DRT-0028]   Complete met3.
[INFO DRT-0028]   Complete via3.
[INFO DRT-0028]   Complete met4.
[INFO DRT-0028]   Complete via4.
[INFO DRT-0028]   Complete met5.
[INFO DRT-0178] Init guide query.
[INFO DRT-0035]   Complete FR_MASTERSLICE (guide).
[INFO DRT-0035]   Complete FR_VIA (guide).
[INFO DRT-0035]   Complete li1 (guide).
[INFO DRT-0035]   Complete mcon (guide).
[INFO DRT-0035]   Complete met1 (guide).
[INFO DRT-0035]   Complete via (guide).
[INFO DRT-0035]   Complete met2 (guide).
[INFO DRT-0035]   Complete via2 (guide).
[INFO DRT-0035]   Complete met3 (guide).
[INFO DRT-0035]   Complete via3 (guide).
[INFO DRT-0035]   Complete met4 (guide).
[INFO DRT-0035]   Complete via4 (guide).
[INFO DRT-0035]   Complete met5 (guide).
[INFO DRT-0036] FR_MASTERSLICE guide region query size = 0.
[INFO DRT-0036] FR_VIA guide region query size = 0.
[INFO DRT-0036] li1 guide region query size = 7.
[INFO DRT-0036] mcon guide region query size = 0.
[INFO DRT-0036] met1 guide region query size = 6.
[INFO DRT-0036] via guide region query size = 0.
[INFO DRT-0036] met2 guide region query size = 5.
[INFO DRT-0036] via2 guide region query size = 0.
[INFO DRT-0036] met3 guide region query size = 3.
[INFO DRT-0036] via3 guide region query size = 0.
[INFO DRT-0036] met4 guide region query size = 0.
[INFO DRT-0036] via4 guide region query size = 0.
[INFO DRT-0036] met5 guide region query size = 0.
[INFO DRT-0179] Init gr pin query.
[INFO DRT-0185] Post process initialize RPin region query.
[INFO DRT-0181] Start track assignment.
[INFO DRT-0184] Done with 12 vertical wires in 1 frboxes and 9 horizontal wires in 1 frboxes.
[INFO DRT-0186] Done with 1 vertical wires in 1 frboxes and 1 horizontal wires in 1 frboxes.
[INFO DRT-0182] Complete track assignment.
[INFO DRT-0267] cpu time = 00:00:00, elapsed time = 00:00:00, memory = 106.19 (MB), peak = 107.30 (MB)
[INFO DRT-0187] Start routing data preparation.
[INFO DRT-0267] cpu time = 00:00:00, elapsed time = 00:00:00, memory = 106.19 (MB), peak = 107.30 (MB)
[INFO DRT-0194] Start detail routing.
[INFO DRT-0195] Start 0th optimization iteration.
    Completing 10% with 0 violations.
    elapsed time = 00:00:00, memory = 122.93 (MB).
    Completing 20% with 0 violations.
    elapsed time = 00:00:00, memory = 142.26 (MB).
    Completing 30% with 3 violations.
    elapsed time = 00:00:00, memory = 142.52 (MB).
    Completing 40% with 3 violations.
    elapsed time = 00:00:00, memory = 143.55 (MB).
[INFO DRT-0199]   Number of violations = 3.
[INFO DRT-0267] cpu time = 00:00:00, elapsed time = 00:00:00, memory = 449.62 (MB), peak = 485.45 (MB)
Total wire length = 169 um.
Total wire length on LAYER li1 = 0 um.
Total wire length on LAYER met1 = 76 um.
Total wire length on LAYER met2 = 59 um.
Total wire length on LAYER met3 = 32 um.
Total wire length on LAYER met4 = 0 um.
Total wire length on LAYER met5 = 0 um.
Total number of vias = 21.
Up-via summary (total 21):.

---------------------
 FR_MASTERSLICE     0
            li1     7
           met1    11
           met2     3
           met3     0
           met4     0
---------------------
                   21


[INFO DRT-0195] Start 1st optimization iteration.
    Completing 10% with 3 violations.
    elapsed time = 00:00:00, memory = 449.62 (MB).
    Completing 20% with 3 violations.
    elapsed time = 00:00:00, memory = 449.62 (MB).
    Completing 30% with 3 violations.
    elapsed time = 00:00:00, memory = 449.62 (MB).
    Completing 40% with 3 violations.
    elapsed time = 00:00:00, memory = 449.62 (MB).
    Completing 50% with 3 violations.
    elapsed time = 00:00:00, memory = 449.62 (MB).
    Completing 60% with 3 violations.
    elapsed time = 00:00:00, memory = 449.62 (MB).
    Completing 70% with 0 violations.
    elapsed time = 00:00:00, memory = 449.62 (MB).
    Completing 80% with 0 violations.
    elapsed time = 00:00:00, memory = 449.62 (MB).
    Completing 90% with 0 violations.
    elapsed time = 00:00:00, memory = 449.62 (MB).
    Completing 100% with 0 violations.
    elapsed time = 00:00:00, memory = 449.62 (MB).
[INFO DRT-0199]   Number of violations = 0.
[INFO DRT-0267] cpu time = 00:00:00, elapsed time = 00:00:00, memory = 485.38 (MB), peak = 485.45 (MB)
Total wire length = 167 um.
Total wire length on LAYER li1 = 0 um.
Total wire length on LAYER met1 = 71 um.
Total wire length on LAYER met2 = 60 um.
Total wire length on LAYER met3 = 35 um.
Total wire length on LAYER met4 = 0 um.
Total wire length on LAYER met5 = 0 um.
Total number of vias = 21.
Up-via summary (total 21):.

---------------------
 FR_MASTERSLICE     0
            li1     7
           met1    11
           met2     3
           met3     0
           met4     0
---------------------
                   21


[INFO DRT-0198] Complete detail routing.
Total wire length = 167 um.
Total wire length on LAYER li1 = 0 um.
Total wire length on LAYER met1 = 71 um.
Total wire length on LAYER met2 = 60 um.
Total wire length on LAYER met3 = 35 um.
Total wire length on LAYER met4 = 0 um.
Total wire length on LAYER met5 = 0 um.
Total number of vias = 21.
Up-via summary (total 21):.

---------------------
 FR_MASTERSLICE     0
            li1     7
           met1    11
           met2     3
           met3     0
           met4     0
---------------------
                   21


[INFO DRT-0267] cpu time = 00:00:01, elapsed time = 00:00:01, memory = 485.38 (MB), peak = 485.45 (MB)

[INFO DRT-0180] Post processing.
Saving to /foss/designs/SKY130_SAR-ADC/openlane/adc_edge_detect_circuit/runs/foobar/results/routing/adc_edge_detect_circuit.def
